#SurvivorFinale I'm glad Sara won  she deserved it. It has been an amazing season she deserved it. It has been an amazing season just a joy to watch!,6, ,,,,
@kellycreeves Heya sweet girl!! Hope I didn't miss it!!! Happy birthday Kelly!! Sending you hugs and joy:)))),5,,,,,
"\""May you be strengthened with all power according to his glorious might for all endurance and patience with joy.\"" -Colossians 1:11",0, ,,,,
I hope life treats you kind and I hope you have all you've dreamed of..and I wish you joy and happiness but above all this I wish you love,5,,,,,
May all those suffering in selfishness realise the liberation and joy of emptiness.,5,,,,,
Emerald its a joy .. its a joy and its encouragement to pick us as winners \nBeena UAE,6,,,,,
Vance Joy - Riptide,0,,,,,
take part in this challenge which will fill my heart with joy great. @ASUSIndia #GoLiveBeautifully,6,,,,,
awww seems like joy got a new fansite oh yes ;;,6,,,,,
MARY J. BLIGE - YOU BRING ME JOY,6,,,,,
Now playing Count It All Joy by Ruth LaOntra!,0,,,,,
i want chicken joy,6,,,,,
I sit in my pain and my reality now because I want to sit in my joy and reality tomorrow.,0,,,,,
comparison is the thief of joy,0,,,,,
Finally getting an iPhone actually brought me literal joy.,6,,,,,
Actually we need more Yeri pictures also. And Joy's. And Seulgi's. Every member. I can never get enough of rv,0,,,,,
Psalm 30:5\nFor His anger is but for a moment \nHis favor is for life; Weeping may endure for a night But joy comes in the morning.,0, ,,,,
Joy wouldn't feel so good if it wasn't for pain.,6,,,,,
Only those who have learned the power of sincere and selfless contribution experience life's deepest joy: true fulfillment.,0,,,,,
like... I I love him. I really do. sincerely and from the bottom of my heart I couldn't thank him enough for how much joy he's brought,6, ,,,,
Fill your heart with joy awesome by participating in #GoLiveBeautifully challenge @ASUSIndia and win Zenfone Live at this point,5,,,,,
At a moonlights crest\nAt a Starlights Edge\nAt the crickets sound\nAt this midnights Joy\nAt A Good Night &amp; #ThankyouJesus \n#Poem #goodnight,6,,,,,
"Joy Reid to @maddow \""In the current news cycle it's hard to know if you are hallucinating or not.\"" lol",6,,,,,
Guys Let's fill ur heart with joy astonishing by participating in #GoLiveBeautifully challenge @ASUSIndia and win Zenfone Live at this point,5,,,,,
"\""But the Holy Ghost being the love and joy of God is his beauty and happiness\"" - Jonathan Edwards",0, ,,,,
The whole joy of writing comes from the opportunity to go over it &amp; make it goodone way or another' James Salter - my 5th redraft inspo,0,,,,,
chick en joy,6,,,,,
I'm In between joy and pain,0,,,,,
Today's my last ever university exam. Not sure whether to be sentimental or cry with joy!,6,,,,,
AND I SEE JOY JOY.,6,,,,,
JELLY JOY.,0,,,,,
CHICKEN JOY.,0,,,,,
Only those who have learned the power of sincere and selfless contribution experience life's deepest joy: true fulfillment. #KobmaxQueen,0,,,,,
Looks like it could be the hottest day of the year so far today. I will be wearing a suit &amp; tie for the warmest part of it. Deep joy.,6,,,,,
For in our great sorrow we learn what joy means.,0,,,,,
The post-credits scene to #piratesofthecaribbean5 is the first time I've ever screamed out loud for joy in a movie theater.,6,,,,,
It's such a precious special-but fragile-time. Don't ruin this joy for her. She gets enough shit every day as it is &amp; after Blue preg? Yeah,0,,,,,
"\""True love is the joy of life.\n- John Clarke\""\""\n\n#ALDUBxDTBYFinale",0,,,,,
I just finished watching season 6 of @OnceABC today and I was crying tears of joy afterwards.,6,,,,,
@robinlordtaylor and @mister_CMS are a total joy to watch together. I suspect they really enjoy it,6,,,,,
Fill your heart with joy amazing by taking part in #GoLiveBeautifully Antakshari Contest by @ASUSIndia where you can win energizing prizes,5,,,,,
 Hi Joy thank you for following! I love making visionaries proud. How about you?,5,,,,,
#NowPlaying Apexape feat Josh Barry - Joy &amp; pain,6,,,,,
Does it bring you joy to see me in such pain?,5,,,,,
Pools of sorrow waves of joy,0,,,,,
i hope your summers are filled with endless love and joy.,5,,,,,
My pastor said HAPPINESS is as a result of HAPPENINGS and JOY is UNSPEAKABLE. \n\n#PBF,0,,,,,
Is there anyone who wanna join NCT - RV Squad? Except: Jaehyun Yeri  Irene  and Joy,5,,,,,
And I wonder how much more wonderful the world could have been if Steve could have spread a bit more joy where he walked.,9,,,,,
Welcome the month of #Ramadan with the heart filled with peace harmony &amp; joy. May the divine blessings of Allah protect and guide us.,6,,,,,
rv filming a reality show(?) sans joy a bitch is crying,6,,,,,
Joy instead of pain,6,,,,,
super eager to take an interest in this challenge which will fill my heart with joy wonderful. @ASUSIndia #GoLiveBeautifully,5,,,,,
Only those who have learned the power of sincere and selfless contribution experience life's deepest joy: true fulfillment.,0,,,,,
Less hate. Less stress. Less pain. More love. More rest. More joy.,6,,,,,
Gal.5.22\nBut the fruit of the Spirit is love  joy peace longsuffering kindness goodness  faithfulness,0, , , , ,
I don't find joy in anything either,0,,,,,
@RaananaDental Bless you with Proverbs 31:10-31. Today has been trying.Glad to have a contact that brings instant joy. Bless you in Jesus!,6,,,,,
Now playing: With Joy by Jonathan and Emily Martin,0,,,,,
i find it sad most people know joy division for the t shirt,0,,,,,
I am thrilled with joy on hearing about @ASUSIndia #GoLiveBeautifully contest where we can grab Zenfone live mobile.,6,,,,,
I pray that you find love comfort joy adventure &amp; peace with beloved family and friends. This is so that you have no hate no spew around.,0, , ,,,
Less expectations will make us more happy knowledge aware us about how to handle the unexpected things in our life with love and joy......,0,,,,,
"\""Love puts the fun in together  \nthe sad in apart \nand the joy in a heart. \n~ Anonymous ~\""\""\n\n#ALDUBxDTBYFinale",0, ,,,,
It was a love all consuming around the clock. Beauty bliss  pain joy like no other. It is a love that doesn't die rare raw and still,6, ,, , , 
#ALDUBxDTBYFinale\n\nA karma born of only living Why does that invoke suffering instead of joy?,5, ,,,,
Whenever u face difficulty\/u receive joy u must share it with others.\nDon t hide. Hiding is a sin.,0,,,,,
"\""The present moment is filled with joy and happinessm If you are attentive you will see it.\""   hich Nhai Hanh",0,,,,,
instead of treating them as if they're anything less than a person brings so much joy to me,6,,,,,
"\""I wanna be where you are. \nI gotta be where you are.\nPeace is where you are. \nJoy is where you are \n&amp; love is who you are\""",6,,,,,
The inner peace of mind that comes with greater joy knowing God is on your side at all levels is awesome,6,,,,,
i know all i talk about is work but it is nuts how much joy my coworkers bring to me and i just thank God every night for their friendship,6,,,,,
I'll think of the way So I'll think of you I will always love you every step of you joy and happiness But above all this,6,,,,,
Sheldon Bangera - Anand Ki Bharpuri (Fullness of Joy),6,,,,,
(The Joy of The LORD is My Joy and My STRENGTH and will turn every wound into a blessing.),0,,,,,
The way to encounter the Lord is if we give up everything. Surrender all you have and the utmost ultimate Joy will come your way.,6, ,,,,
And no outsider can share in its joy. #NadineCharityGarageSale,6,,,,,
I find joy in every day not because life is always good but because God is.,6, ,,,,
"\""I AINT A KILLER BUT DONT PUSH ME REVENGE IS LIKE THE SWEETEST JOY NEXT TO GETTIN PUSSY\""",2,,,,,
Ross on a J Dilla beat. Man i wouldnt stop crying tears of joy,6,,,,,
Joy of the day: Getting to hear the Mormon tabernacle Choir rehearse.,6,,,,,
I'm gonna love the joy I wanna get wit it It's like that It's like that I'm gonna have 2 keep on God shit Off a move) Said,5,,,,,
Joy multiplies when it is shared among friends but grief diminishes\nwith every division. That is life.  #ALDUBxDTBYFinale,0,,,,,
The secret to finding of joy in work is excellence.,0,,,,,
Folk fill your heart with joy marvelous by partaking in the challenge to win energizing prizes from @ASUSIndia #GoLiveBeautifully,5,,,,,
I feel so much joy tonight which is really great.  I'm very thankful,6,,,,,
A mouthful of joy.,6,,,,,
For his anger is but for a moment and his favor is for a lifetime. Weeping may tarry for the night  but joy comes with the morning. Ps 30:5,0,,,,,
Happiness lies in the joy of achievement and the thrill of creative effort. Franklin D. Roosevelt,0,,,,,
"\""It brings me so much joy when a little brat finally loses the one he loves so I can jump in and make him mine.\""",6,,,,,
hello joy.,0,,,,,
@AduduTrish thanks for the shout out Trish. Fantastic show fantastic presenter. Always a joy listening to you on way to work x,6,,,,,
i feel joy everytime stancy talks about his ocs,6,,,,,
The gloom of the world is but a shadow; behind it yet within our reach is Joy. - Fra Giovanni,0, ,,,,
@ShannonSharpe Hey man what's up with Joy Taylor always maddogging you? It's annoying to watch. is it a jokey thing between you two or what?,5,,,,,
Happy Happy Joy Joy,6,,,,,
I get so much joy out of skirting the line between hell of ironic \/ hell of sincere appreciation for Bitmoji,6,,,,,
Happy happy joy joy !!,9,,,,,
Its a privilege 2 have a task that justifies pouring every ounce of energy into it that creates a sense of joy that gives energy back\nAl Gore,0,,,,,
A LOVELY HEART IS A TREASURE OF BLESSINGS PEACE JOY AND HOPE,6, ,,,,
To see happiness in others brings me equal amounts of joy.,6,,,,,
The joy of the Lord is your strength! \nPride prevents us from doing the Godly thing! Deny self and pick up your cross!,0,,,,,
Goodnight family! May you have peace as you sleep and joy when you wake. In Jesus' name.,5,,,,,
I want to celebrate with them. The joy is electrifying. From some Indian cultures to Islamic praise dances depending on where from &amp; more.,6, ,,,,
Three Dog Night - Joy to the World,6,,,,,
Today has been filled with so much love so much that I was overwhelmed and cried tears of joy and then sad tears for the seniors�,6, ,,,,
Today has been rough but I will not ...I repeat will not let the enemy steal my joy! I love being happy and I am not going to stop now!,9,,,,,
My family kept The Joy of Gay Sex,6,,,,,
Opening night tonight Dalby! Joy Holt will be there doing her thang!\n #Toowoomba #IVF #IVFStoryBook #DalbyArtExhibition,9,,,,,
I pray that you find love  comfort joy adventure &amp; peace with beloved family and friends. This is so that you have no hate to spew around.,5, , ,,,
There is great joy and satisfaction in competing against an opponent who forces you to dig deep and produce your best.,6,,,,,
This joy we have - the world didn't give it - and the world can't take it away!,6,,,,,
Without pain how can we know joy? (JG),5,,,,,
Find strength in joy Let His words lead you on. Not forgetting His faithfulness for He will finish what He begun,0, ,,,,
Once you truly meet God the peace and irrevocable joy He brings cannot ever be matched. He is the end all He is the Great I Am.,6, ,,,,
@halsey released a single using female pronouns and didn't make it this huge deal and now I'm crying tears of joy in my bedroom,6,,,,,
was cleaning my room earlier and i left my phone downstairs with huff n puff playing and joy's laugh at the end scared the hell out of me,7,,,,,
Sunny days wouldn't be so special if it wasn't for rain. Joy wouldn't feel so good if it wasn't for pain.,0,,,,,
comparison is the thief of joy,0,,,,,
Happy birthday friend @NinaNikitaZion \nGod bless you with all the joy and happiness in the world. I appreciate you.,5,,,,,
What a nice feeling to be in love with God. No pain. No heartache. No disappointment. Just blessings and non stop joy.,6,,,,,
93.Light and joy and peace abide in me.,6,,,,,
Vice ganda is my bundle of joy talaga:)),6,,,,,
I will always love you I wish you joy and happiness But above all you've dreamed of the way And I know I'll always love you,5,,,,,
Grief can take care of itself; but to get the full value of a joy you must have somebody to divide it with. -- Mark Twain,0,,,,,
Thank you @TimothyCBest for visiting the @supattackgames office to spread joy on #PositiveDay!,9,,,,,
Give as much as you can expecting nothing in return. Simply for the good of mankind. For the joy received by spending joy.,0,,,,,
Learning to live in the present\nmoment is part of the path to joy. \n\n #ALDUBxDTBYFinale,0,,,,,
Quraan in Arabic is a deep thing for me. i listen to the audios with joy my deepest truths is spoken in a way that even myself i cant match,6,,,,,
I hope to spread the joy of English vocaloids even further~! #stratusbot,9,,,,,
I'm going to block out the rage by focusing on the joy of Greenwood playing more in the midfield.,0,,,,,
#SachinInTheatres and the fans happiness and joy is simply amazing to watch the legend @sachin_rt on the Big Screen!,9,,,,,
Joy Behar touched 2 Chainz like she was inspecting him at an auction.,0,,,,,
"#Today \""You can't fall if you don't climb. But there's no joy in living your whole life on the ground.\"" Unknown",0,,,,,
For the kingdom of God is not a matter of eating and drinking but of righteousness  peace and joy in the Holy Spirit ~ Romans 14:17,0,, ,,,
too many joy rides in daddy's jaguar,6,,,,,
A joy that's shared is a joy made double.,6,,,,,
tears of joy,6,,,,,
joy!,6,,,,,
My joy's image is coming againeverytime I see yeri,0,,,,,
The joy I'm feeling right now...,6,,,,,
IT'S A GREAT F-ING NIGHT! BLESSED AF! I'M CRYING FOR JOY!,6,,,,,
"\""Money is a strange thing. It ranks with love as our greatest source of joy and with death as our greatest source of anxiety.\""  Joe Moore",0,,,,,
Happiness and joy,6,,,,,
my heart is fluttering with joy for this album u guys don't understand,6,,,,,
[remembers the megidos exist] [promptly begins crying tears of joy],6,,,,,
"\""Failure sometimes happen. Shxt somethimes happen.\"" - sir Joy \n\nShookt ako na nag sabi nya ng 'shxt'",0,,,,,
good morning i dreamt i told hilarie burton to follow james and joy and she said she's already following james but she wasn't,0,,,,,
when i listen to t7s music i actually become incapable of feeling anything but immense joy,6,,,,,
13a.McCoy Mrubuta.Tears of Joy,6,,,,,
Reflect on your joy attain your empty nausea. This would never happen.,0,,,,,
"\""Worry never ro.s tomorrow of its sorrow it only sx;s today of its joy.\""   Leo Buscaglia",0,,,,,
#NowPlaying Joy Tabula Sembera - Unknown,0,,,,,
i got power poison pain and joy inside my dna,6, ,,,,
Why Pandora's Flight of Passage ride made me cry literal tears of joy,6,,,,,
#BTSforVMAs @vmas BTS FANS CALL ARMY WAS REALLY HARD STEAMING BTS MV 24\/7 IS NOT FOR BREAKING RECORD BUT FOR JOY AND REALLY LOVE BTS MV.,6, ,,,,
So glad that #Festivalofhappiness will carry on tomorrow @settlestories. Kindness &amp; joy will always defeat terror. Hate never wins.,6,,,,,
I'm left to wonder... Ah  it doesn't matter. What's done is done right? Cicero is here! As is the Night Mother! Joy of joys!,6, ,,,,
@Xbox I've waited 3 years for Friday the 13th game and you have now stolen the joy of being able to play the minute it comes out on launch.,0,,,,,
I take an interest in this challenge which will fill my heart with joy marvelous. @ASUSIndia #GoLiveBeautifully,5,,,,,
You can have joy without money  #CitamFamilyFest2017,0,,,,,
Time to fill our heart with joy all more essential by watching the energizing story of the @sachin_rt sir #SachinInTheatres @SachinTheFilm,6,,,,,
Roku already has the new episodes of The 100  IM CRYING JOY TEARS,6,,,,,
Time for take an interest in this challenge which will fill my heart with joy marvelous. @ASUSIndia #GoLiveBeautifully,5,,,,,
"administration had acted \""by naked power by threats  by agents of the state security police. Joy in Fucking Kid.",2,,,,,
it'd be an achievement for him to rank #1 of course i'd freaking fly out of joy but thinking of his haters otw to eat his soul? no thanks,6,,,,,
They are contradicting and has fierce sexual ecstasy first Sensual feeling Because the loss of erotic joy is suffused with,0,,,,,
People like being busy because they hate the silence. In Christ Jesus silence is precious in the silence there is peace fellowship &amp; Joy,0, ,,,,
One joy scatters a hundred griefs. ~Chinese Proverb,0,,,,,
Folks fill your heart with joy energizing by playing Antakshari #GoLiveBeautifully with @ASUSIndia and Win Big,5,,,,,
graduate saturday. people are gonna be crying and i'm gonna be crying tears of fucking joy. high school sucked! gbye,6,,,,,
"Jared and Ivanka are \""The Commander\"" and \""Serena Joy\"" from \""The Handmaid's Tale\"".",0,,,,,
#EscapeGameShow tonight on joy prime tv GH,0,,,,,
if sm are really holding red velvet's reality show until they comeback then that's ridiculous since joy didn't even film it with them.......,6,,,,,
Cried tears of joy just now watching Price is Right. Its 8:30am. I need a job.,6,,,,,
gotta go through the pain to experience the joy,6,,,,,
Why are babies called Bundle of Joy? Is changing diapers so much fun and are sleepless nights with them are joyous nights?,5,,,,,
Vernal delight and joy  able to drive,6,,,,,
Find a place inside where there's joy and the joy will burn out the pain.,0,,,,,
#God's joy is unspeakable...,6,,,,,
I've got joy in my heart.,6,,,,,
