@SayeedaWarsi watching you on Daily Politics is making me angry. You are an absolute disgrace.,1,,,,,
Angry people on Twitter misunderstanding. That's why I got an account  to inform them that they were wrong.,7,,,,,
there are entire accounts on instagram dedicated to snape and defending him . sometimes i read their posts and just get angry as hell,1,,,,,
#ES_F 60 MIN Hourly Cycle to Impact 8 am CST-last few hrly cycles have had some significant effects (4\/16\/17 was the best with angry pink),5,,,,,
fuck man if megahouse made a ging figure that looked like that i'd be so angry but you know i'd pre-order that shit day one. so yeah,1,,,,,
"\""Traditional healers in Liberia say the nation is experiencing an economic crisis. [...] because ancestral spirits [...] are very angry.\""",0,,,,,
Someone ate the fucking cupcake I got for my big bro &gt;8(\nI'm so angry,1,,,,,
mayo is a furry and a tyrant. he started an angry mob against me,3,,,,,
Now I'm angry!,1,,,,,
About 5 angry #SB4 tweets composed &amp; then deleted this morning. So you can thank me. I'm just not in the mood to argue w\/ hateful ppl today.,0,,,,,
my dad got angry at me for watching the get down,7,,,,,
@virginmedia yet another day without internet and poor #customerservice quite a few angry customers here #virginmediasucks,1,,,,,
Im angry with myself!!!!! ,1,,,,,
Angry Again | Megadeth | Last Action Hero #megadeth #inthemood #nowplaying,1,,,,,
Jack Bader has a gun an; is often angry,1,,,,,
angry,1,,,,,
Why does everyone hate on angry orchards? Lol,6,,,,,
alone and angry crying about how constricting dams is on par with culture genocide,1,,,,,
I ate one good meal today and got legitimately angry at my body when I got hungry again,1,,,,,
Probably shouldn't started drinking at  5 when the last time I ate was noon.. angry elf,1,,,,,
I act like i don't care but deep inside i am very angry from you !,1,,,,,
Never speak harsh words For they will rebound upon you. Angry words hurt And the hurt rebounds. Like a broken gong.,4,,,,,
Saturday morning really bad morning \nI lost my temper  wat next anger is never good \nI don't feel good after getting angry on something..,2, ,,,,
I hate it when I get angry,1,,,,,
Rei and Mikila can really make me angry sometimes.,1,,,,,
There will be so many people angry but there will be the part of the fandom that even sad will understand the situation,7,,,,,
y'all sleep on 12 angry men that is a great film,5,,,,,
"I made my dad angry :\""\""\"")",1,,,,,
Hee. You seem angry.,1,,,,,
Really angry.,1,,,,,
Literally all my emotions right now is scared  sad  angry and disappointed.,1,,,,,
From Heaven they fabled  thrown by angry Jove,1,,,,,
I'm honestly so angry. I hate people,1,,,,,
Angry syrup queen,1,,,,,
Dirty ambition person will not successful in Long run. Example pavurala gutta tragedy. Every one has to go but not with 6 crore public angry,0,,,,,
Just read an article that talked about instagram influencers as a job! Is that real? Am now angry &amp; confused for some reason.,1,,,,,
I appreciate the kindness in people. We live in an angry society  not much good is left in others now.,7,,,,,
Men need to stop telling women with a resting bitch face that they look angry &amp; should smile. We don't care &amp; we don't want to smile at you.,1,,,,,
Two hours into #Beevers Battle for Spain and already angry.,1,,,,,
Also: they are going to get angry at you  because they don't understand your struggle  and they don't care enough to try to help.,7,,,,,
I lived in Wisconsin for 7 years. Any diet\/lifestyle that requires me to give up dairy immediately makes me angry. Like hide ya kids angry.,1,,,,,
Okay. Done. And I'm home. No more angry rants.,6,,,,,
This deaf baby hearing for the first time is nice  but the people getting angry over it make me want to die twice as much,2,,,,,
I'm getting sooooo angry! #HouseRules,1,,,,,
So na Uber dey cause anger on Twitter today. Always angry Twitter will never die.,1,,,,,
Don't ignore someone u care about bc lack of concern hurts more than angry words(Dainty~),7,,,,,
i forgot my highlight i'm so angry,7,,,,,
Makes me sad and angry and a bunch of other emotions all at the same time.,7,,,,,
When God seems distant  you may feel that he is angry with you or is disciplining you for some sin.,7,,,,,
I remember when it was 6 and I was asleep and not angry,0,,,,,
Not going to analyze a split-second play in slo-mo. Too angry to think about that. I'm more disgusted by the people that are happy he's gone,2,,,,,
If my fellow Man Utd fans did the same thing i'd be at least twice as angry  disgusted and ashamed!,1,,,,,
Saw a video of french far right cunts burning and stepping on a rainbow flag today and it's made me so angry how's your morning?,1,,,,,
For every minute you are angry you lose sixty seconds of happiness. - Ralph Waldo Emerson,7,,,,,
Twitter is on edge already this morning... almost violent.  Virtual Hunger Games.  Y'all are some angry fucks.  Love it.,6,,,,,
I be angry asf in the morning.,1,,,,,
You're in Dr F's lab. There is an angry letter on the back of a tortoise.,1,,,,,
I wake up angry because I wake up alone lol,6,,,,,
IM angry...,1,,,,,
i accidentally sent my angry version of the text just when i'm about to edit ittttt ugh my god,7,,,,,
Your smile is contagious  no matter how angry or sad I am  all I need is to take one look at your smile and everything is better.,5,,,,,
My motivation is just gone right now but if I don't finish them my mom will get so angry.,3,,,,,
I am legitimately so angry lately,1,,,,,
That makes me angry against the Spanish.,1,,,,,
Andrew Jackson would have been angry and never let the Civil War happen? Sounds right. Why would a plantation and slave owner end slavery?,0,,,,,
I asked her why she would expect to be beaten by her husband just cos he's angry or got a wrong information? She said cos he's a man,7,,,,,
If you are right then there is no need to get angry\n\nAnd if you are wrong then you don't have any right to get angry\n\n..except with yourself,0,,,,,
I don't like to be angry because when i am  there's nothing you can do. \nThat's why i like to pretend  i am okay,0,,,,,
I'M AWAKE AND ANGRY AND WE'RE HERE NOW,1,,,,,
People who never cared about genocide denial are now angry about revisionism of Civil War  but historical revisionism has been happening.,1,,,,,
Haru getting angry about not knowing the name of the cereal is srsly funny but heartwarming...continue to grow beautifully #HappyHaruDay,6,,,,,
I am voting for @justinbieber as Top Social Artist in the #BBMAs #JustinBBMAs You gotta go and get angry at all of my honesty,5,,,,,
Im laughing bc of the fans that get so angry and possessive when an idol is talking to a girl like its not your life and your decisions stfu,6,,,,,
#Libra's dont get angry very quickly.,7,,,,,
Women need to drop this mentality that their husbands are allowed to hit them just cos they did wrong or cos he's angry,5,,,,,
feeling angry,1,,,,,
Sica cries when she's angry #Fact,5,,,,,
Man  so angry?,0,,,,,
@narendramodi pls ask your ministers not to repeat kadi ninda. We are angry nothing short of physical retribution is acceptable,1,,,,,
President Andrew Jackson saw @realDonaldTrump coming and was angry. Would never have let it happen! #AlternativeHistory,1,,,,,
Get angry at all my honesty,1,,,,,
There's nothing that makes me angry like CANDY CRASH,1,,,,,
i've been angry about this arc since house of hades and i'll be angry about it until the day i die,1,,,,,
Ugghhhhhh I'm angry =_=,1,,,,,
Thanks Angry Voters your protest vote was awesome #100daysofpuregarbage,9,,,,,
I'm so angry. I'm so fucking angry,1,,,,,
i woke up angry and frustrated,1,,,,,
A TEACHER JUST YELLED OI! RLY ANGRY IN THE CORRIDOR AND I GOT SUCH A FRIGHT,1,,,,,
I'm sorry I got angry and said a lot of things I mean but shouldn't have said. #sorry #sorrynotsorry,4,,,,,
lolnmy dad got super angry at me for not eating his boring pasta... shit got no cheese or garlic,6,,,,,
Do you hear the #budgies sing  singing the song of angry birds. It is the music of the budgies who do want their tub again #LesMis #birdbath,0,,,,,
I get angry real quick  and simmer down quick too.,7,,,,,
I left the classroom right after they started talking shit about it cuz i didn't wanted to get angry,2,,,,,
This is definitely NOT the way to go when it comes to educating people. Yes we are angry. But anger does not need to translate into abuse.,1,,,,,
ay good day i'm angry,1,,,,,
Left wing people are so quick to name call and get angry. Absolute belief in their view - thankfully I don't give a fuck right or left.,2,,,,,
I'm not livid or angry. Just stating facts.,0,,,,,
President Donald Trump  who was born 81 years after the Civil War  heard about it and was angry. Would never have let it happen!,9,,,,,
I think it's time to find myself a new career path.. I've become too angry taking IT support calls  simple things kill me.. maybe I'll blog.,1,,,,,
"\""My team lost and I am angry\""",1,,,,,
Shit Vance IS sexy when he's angry,6,,,,,
Reizo is scary when he's angry...,3,,,,,
I hate my nerves. Makes me guilty everytime i'm angry.,2,,,,,
Andrew Jackson was very angry at who shot JR #TrumpTeachesHistory,1,,,,,
So. If you ever get angry or upset with someone  remember it's your rules that are upsetting you. Not their behavior,7,,,,,
Ran out of coffee so yennno I'm just going to work angry,1,,,,,
The key to that is to make things with the frustrated and angry energy you get from that embarrassment. Produce something that is yours.,5,,,,,
Hmm. Been a long time since I got this angry on Twitter and roasted people. \nIt's a sign... I HAVE RUN OUT OF ALCOHOL.,1,,,,,
Largely bc I've spent most of this morning writing emails &amp; being angry,1,,,,,
My son wakes up so angry lol,6,,,,,
Errr why is Anya so angry all the time? Maybe if we go out for pasta she'll feel better nya!,5,,,,,
finland has a bigger population than norway yet we are treated like this everytime i'm angry,1,,,,,
FRIG  you know how the canon of underground is Bam Margera died? What if that made Knoxville so angry he formed an anti-tony rebel movement,5,,,,,
Not sure who gave Travis Rudolph bad advice but it makes me angry.,1,,,,,
so angry,1,,,,,
watching The Angry Birds Movie,5,,,,,
silently very angry,1,,,,,
LITERALLY NOTHING MAKES ME MORE ANGRY THAN WHEN MY FAMILY TAKES MY LEFTOVERS I WAS PLANNING TO HAVE FOR LUNCH,1,,,,,
tbh im so tired and annoyed im so angry and sleepy ya allah,1,,,,,
Watching Blair on the steps of Downing Street in '97 makes me angry. I was so happy after all the years of Thatcherism. Little did I know...,6,,,,,
Traffic makes me so fucking angry,1,,,,,
Im so fuckin angry,1,,,,,
Now Cesaro is the angry one and Sheamus is the funny one. #WWERaw,5,,,,,
The MSM wonders why DJT still so angry that PBO 'tapped' him. What if you replaced the word 'tapped' with the word 'CAUGHT'... Now replay...,5,,,,,
Lol. Yer Ma is angry. Let me run to yer Da,6,,,,,
@anthonyfjoshua Why do you always look angry after a fight? doing press conference. I just want to know. If is okay for you?,5,,,,,
If you are right then there is no need to get angry\n\nAnd if you are wrong then you don't have any right to get angry\n\n..except with yourself,0,,,,,
I honestly don't know what's so hard about being polite and well mannered tho. U bitches be so angry all the time,2,,,,,
@Bhuvan_Bam bro angry masterji ka aur koi episode aayega?,5,,,,,
My twitter day is incomplete until I see the single  middle aged  angry because mammy forgot to buy Frosties  man tweet.,7,,,,,
To the angry and hateful: Everyone who attends church is just like you a sinner and you're not the Judge of the weight or worth of sin.,0, ,,,,
Time for sleep now. Im still not calm. Trans kids progress set back today and it's heartbreaking and I have angry frustrated tears.,1,,,,,
Can't tell you how many times friends have tagged me on pictures of tiny  adorable  angry animals with the caption,0,,,,,
I am voting for BTS for TOP SOCIAL ARTIST at the #BBMAs. RT to vote! #BTSBBMAs angry,5,,,,,
"\""Trump's 100th\"" I find myself feeling more &amp; more angry at Trump voters &amp; the GOP for their part in creating this disaster of a presidency.",1,,,,,
@TigerAir I have been on hold for 20 mins. Ive calld 5 different phone numbers and sent in circles. Your website doesnt work. I am so angry!,1,,,,,
But there is probable that it was equally angry.,0,,,,,
Did you really think I'd fall for a trick as simple as getting angry and walking right into my trap?,0,,,,,
Hello  I'm down here now! And I'm very angry for reasons I'm about to explain! Ta-daaah!,1,,,,,
I used to hold my phone from falling and I accidentally pressed like button for so long and clicked the angry one! Gaaaaaaahd I hate drugs.,9,,,,,
Anyone angry at the squad announcement needs a reality check  need a revamp  far to much deadwood in the squad! Have to look forward! #ncfc,9,,,,,
It's so fucking annoying how angry depressed people accept no help at all but keep complaining about getting no help,2,,,,,
i'm angry that i have like 5 zine ideas and they're all pretty solid but i don't have time to do all of them,1,,,,,
"I forgot mine today  and in the past when I've sat up front  the conductor has been angry but this guy's like  \""It was a monthly? Ok",1,, ,,,
It's really not the best time to make decision when youre angry. Trust me bro youre gonna regret it.,0,,,,,
@KUT I hope Le Pens advisor realizes how angry people are with Trump,7,,,,,
#Leo's are only angry and upset for a short time. Soon they will be back a cheery merry person again.,0,,,,,
Angry with life.,1,,,,,
"My friend thought i said im depressed and got angry with me and said \""STFU youre not depressed\"" in an annoyed way. Little does he know...",1,,,,,
#Aries do get angry quickly  but most times it's out of frustration.,1,,,,,
Can y'all imagine the amount of excuses you wouldn't have if a man was angry he's having a daughter,0,,,,,
people who are angry about gifts they received and express that anger in writing and the gift-giver shares it on social media are disgusting,2,,,,,
Prayers for all those affected by the Manchester terrorist attack #appalled#angry#defiant,1,,,,,
Breaking up with your boyfriend because your angry or bored is pathetic AF hope y'all bitches stay single,7,,,,,
Twitter makes me want to cry laugh  get angry get pissed sad really sad depressed�,7,, , , , 
Chilling w kc &amp; he's over here playing angry birds on his phone,1,,,,,
Me during the week: okay I won't angry live tweet the football this weekend \nMe on the weekend: lol who dis fuck the opposition,6,,,,,
An Angry Po.,1,,,,,
If someone can find a way to make me tired and not angry that'd be great.,6,,,,,
There's going to be a lot of angry fans if #WWE puts the belt back on #RandyOrton at #MITB.,1,,,,,
Y'all racist asses got me angry lol,7,,,,,
Whenever I see a sub lvl 100 whos been on overwatch since summer games i get irrationally angry,1,,,,,
Haven't sat down &amp; played a handheld for over 3 hours like that since I was a small baby boy\n\nMy adult neck is angry but my soul is happy,6,,,,,
When I start laughing knowing I'm angry it's a wrap.,0,,,,,
Wordpress keeps not installing and it's making me angry.\n\nI'm gonna figure this out bluh,1,,,,,
I am so angry someone help and FaceTime me,1,,,,,
Austria: No! He's probably mass-producing white flags as we speak! I'll express how angry I am with this piano.,1,,,,,
I am angry. So f*** angry,1,,,,,
You should express your feelings instead of leaving an individual confused as to why you're upset or angry.,0,,,,,
I don't fear men at all   but I fear a jealous  angry and bitter woman the most !!,3, ,,,,
Idk why but i ended up seeing pics of Bonnie and Enzo and i cant believe how angry i feel bc he died?? Hahahah,6,,,,,
"\""If you can never get angry at anything that probably means you have nothing that you like either\""-Chitanda Eru",0,,,,,
I'm angry coz this is how I feel and you don't deserve any of this bs.,1,,,,,
Angry Bird Otaku Cosplay!,9,,,,,
Trying not to be sad or angry tonight,0,,,,,
3 am eastern time is Angry Hour on my time and honestly im right there with u all let it out,0,,,,,
I have lost friends purely because they've seen me angry at someone- not necessarily people they know. They just never trust me again.,7,,,,,
What To Do When Guests Manage Angry Venues,5,,,,,
Angry moto.,1,,,,,
i don't think i've ever been so angry in such a short amount of time,1,,,,,
I should have stayed calm. I'm not angry I'm just irritated.,2,,,,,
Life is too short to be stressing and being angry all the time,0,,,,,
(honestly i am more angry they dissed the grateful dead then skipped on float on... YA BUNCH OF HIPSTER CR,1,,,,,
It makes me very angry a health care bill says the country -.,1,,,,,
I'm angry and I need to vent lmao,1,,,,,
Dogs are soo lucky they can call there wife bitch and they will not get angry \n#liv_lyf_dog_siz,6,,,,,
ruby is so small and angry all the time. i can't imagine being that small and angry always. she must be tired.,5,,,,,
Stage Magician transformed into angry Vampire,9,,,,,
I am depressed. Dwight was just trying to be honest I'm so angry,1,,,,,
if you think grif close to sobbing is a mood grif saying Fuck and being legitimately heated angry is a Big Mood,0,,,,,
I have only really been that kind of angry a handful of times in my life luckily. Apparently it's Fucking Terrifying.,3,,,,,
Writing tip: it's impossible to write to the background music of Angry Birds even if it's extremely quiet. #amwriting,5,,,,,
"\""He that is soon angry dealeth foolishly: and a man of wicked devices is hated.\"" ~Proverbs 14:17 #Bible",0,,,,,
Leavers should have to apply for a permit to move to a different town then perhaps they'd understand how angry we are.\n#Brexit #GE2017,1,,,,,
We will simply never use cans but rather use snakes and some sort of angry marsupial so that the individual who scavenges our sacred bins,0,,,,,
Ignorance is like sleep your initial reaction is to be angry at the person who wakes you up.\n\nP.S. Religion is bullshit :p,6,,,,,
Most times when you find out a friends true colors you're not surprised or angry  just disappointed...friends often deny the obvious..,7,,,,,
"\""Kiss the Son  lest he be angry and ye perish from the way when his wrath is kindled but a little. Blessed are all they t...\"" ~Psalms 2:12",0, , ,,,
@TheRedBarrels Finished #Outlast2 tonight. I'm angry and disappointed the ending was WASTED with sloppy writing. That was NOT a climax. :-(,7,,,,,
I'll never understand why someone can go through the extreme just to make one so upset\/angry,7,,,,,
RT if you're angry ;(,0,,,,,
So angry sick&amp;tired completely fed up of male religious leaders ramming their tolerance message at us yet most can't tolerate women or lgbt,1,,,,,
I am so fucking angry. I'm fucking pissed.,1,,,,,
Thousands of blue carpathian pachyrizi ! #angry,1,,,,,
I angry,1,,,,,
It takes the truth to fool me and now you've made me angry.,1,,,,,
I care. I sad. I (fake) smile. I love. I confused. I angry. I don't understand about my feeling. Without you I'm nothing. :'),5,,,,,
"\""This version just made me angry though\""",1,,,,,
i'm angry now but watch me wake up later to support samuel and daniel,1,,,,,
Caxtons are angry birds with many utalagus and some are treasured for their jewels,5,,,,,
Tori's quite the fright when he's angry!,9,,,,,
The annoying moment when you get a cryptic text off your husband at home midnight whilst he is on a stag....this leads to a very angry wife,1,,,,,
Hope the videos babes and Mampintsha posted wont ruin their careers its never right doing things while angry #SAMA23,5,,,,,
There's a REALLY LOUD ANGRY ITALIAn mAN in my head right now \nAnd I don't even speak Italian,9,,,,,
How am I supposed to never go to bed angry when the other person to won't talk or listen,9,,,,,
these funks that I fall into every now and again frustrate me so much that I'm unsure if I'm angry at the situation or me thinking about it.,7,,,,,
On a wednesday night a angry man attacked you with a used needle. You countered his attack with your revolver and escaped successfully.,9,,,,,
i am so fucking angry,1,,,,,
Angry karaoke makes for a fun night. Especially when you sing @slipknot at the top of your lungs.,6,,,,,
I don't think I've ever been this calm while being angry,9,,,,,
#Trump shoves #Montenegro's leader and a white supremacist angry he isn't superior to PoC kills two people who get in his way. #Coincidence?,1,,,,,
i watch videos of people who review fairy tail but i havent read it in like 400 chapters because they are always so angry i literally scream,3,,,,,
First i am so done with these scandals about ym and im legit so angry atm but depressed seeing all these negative comments about him,7,,,,,
Why is everyone angry at @MargaretCourt? She's allowed to voice her opinion... just like we're allowed to call her an archaic cunt.,9,,,,,
Can we make a new courtroom drama\/kids film called Twelve Angry Birds? #MovieIdeas,5,,,,,
snapping at parents or partners because they caught me unawares leaping to angry responses when friends don't behave as I expect,1,,,,,
Why did you get so angry?,5,,,,,
I have never been so angry at a picture frame before.,1,,,,,
this one artist draws pokkle suuupper cute  but they always draw him so angry ? i see him as a sweetie but  thats all u bb,5,,,,,
When you're happy the devil fnds a way to get you angry\/sad to ruin your happiness\/peace.Don't give him the chance. +ve vibes only.Be happy,5,,,,,
I'm sorry @BrunoMars even if i love you the way i do  i'm angry with you! We in portugal made the #blessed initiave and what? (Cont),1, ,,,,
You know my face not my story.\n*story is about getting angry and throwing things at people*,0,,,,,
I decided to have a tantrum. I was hoping for a break  I was PRAYING for a break. I got *ucked over  yet again. Now I'm angry&amp;unresponsive.,1,,,,,
Ducky will destroy ducky next week. Angry! &gt;8V,1,,,,,
In the meantime  I know why I am so angry with you,1,,,,,
I'm so angry right now I'm gonna snap,1,,,,,
IM angry...,1,,,,,
"\""Was that Hans Delbrock's brain?\""\n\""Will you be angry?\""\n\""I will NOT be angry\"" \n#youngfrankenstein",5,,,,,
Sorry if your  beautiful \/handsome  but please don't be angry with me couz I have special feelings for you\n#crush,5,,,,,
That unattractive nerdy Asian the angry black female with the finger and moving the head.,0,,,,,
Here's a tip boy and girls: don't play @officialpes #myClub when you're nervous or angry  if you don't want to lose a category. Or two�,5,,,,,
I am angry. So *&amp;@! under the weather,1,,,,,
I am angry. A bit G$*D$*%&amp;(@ under the weather,1,,,,,
going to regret this tweet it may have ruined my angry rep,7,,,,,
guys  if @lilrolo44 doesn't become the next Tobin Heath with her foot work skills  imma be angry she's amazing.,9, ,,,,
I'm trying to listen to Celtic Music to sleep and it was cool for like 10 minutes (30 minutes total) Then it turned to angry loud windchimes,5,,,,,
2 yrs and you've still not heard a word - more and more people getting angry with ya and you still fuck about - in part they blame u.,2, ,,,,
I am so fricken angry that she wanted to take it further and scream at me in the street because her little princess said she didn't do it,1,,,,,
Total bulllshit cause total cowshit doesn't sound so angry!,9,,,,,
Anything human chated to do worst can't kill.\nIf you cheat haters  you are cause of all the haters.\nUniversal human is angry at you!\nABSoka,9,,,,,
greys always leaves me feeling unsatisfied and angry  but i always come back for more. is that what it feels like to be a straight girl?,5,,,,,
Im so hungry\/angry :3,1,,,,,
I am angry because you always lie to me,1,,,,,
I don't know why but suddenly I'm angry at everything I see,1,,,,,
stop telling me I dont have the right to be mad!!! let me be mad and angry and frustrated!!! because thats what I feel!!!,9,,,,,
People who are angry with each other for the silly little things  are usually the ones who care about each other the most.,0,,,,,
he sounds like a tiny angry bee,9,,,,,
TINY\nANGRY\nBEE,1,,,,,
House broken into and car stolen overnight. I'm bloody angry. Feral people in Perth WA,1,,,,,
Stuck. Broke. Hungry. Sad. Angry.,1,,,,,
Just scrolled through my own tweets got angry at how unfunny I am and decided to never speak again,1,,,,,
You actually surprised men are angry they don't get to go see a movie they probably don't want to? PRIVILEGE VIEWS EQUALITY AS OPPRESSION,9,,,,,
I'm wide awake and angry for multiple reasons,1,,,,,
didn't you say that sometimes she is angry ... Well that's just how it is i suppose,0, ,,,,
#SteamDrills -Make it fun huh?  He'd be down there at the protest singing Yankee Doodle instead of chanting angry slogans #Resistance,0,,,,,
im up and im angry,1,,,,,
But Pihne only shows her bright and cheerful side to others. She never cries she never gets angry... She has a fear of opening up.,5,,,,,
I swear I can't ever sleep when I'm angry,1,,,,,
Cancer: emotional but strong - the angry cryer,5,,,,,
I always see gentle girls online full of sunshine and flowers and I wish I was too but I'm angry and full of memes and unresolved trauma.,1,,,,,
Riri saw that tweet and she was angry AF but I manager her ukumthoba umsindo bcs I'm real niggah,6,,,,,
if anything happens&amp;they're angry they start calling me a schizo!as if my illness is to blame for everything I do.though it's not.,9,,,,,
Giving money to NASA is what made that guy angry? That's the worst thing Trump has done?,5,,,,,
And You Would Rather Me Be Sad Than Angry,5,,,,,
I can't stand when people get angry drunk like take that shit somewhere else,0,,,,,
Shiro would probably work himself to exhaustion and keith tries his best to make sure shiro eats and sleeps properly and gets angry when,5,,,,,
Can you feel the tension?\nIf you're not angry  you must not be listening,5,,,,,
