@SayeedaWarsi watching you on Daily Politics is making me angry. You are an absolute disgrace.,1,,,,,
In the midst of a bad day I remembered Bob Ross saying talent is a pursued interest &amp; I felt stupid for being angry.,7, ,,,,
i'm always so angry i need like therapy or something.,2,,,,,
As of this moment it is my duty as a friend  to get @TPalm3030 so drunk his girlfriend is angry when he comes home. #achievable #getit,5, ,,,,
I am unstable. So %*$&amp;@! angry,1,,,,,
Super angry (sinus?)  headache and angry eyes from allergies and wearing contacts isn't helping,7,,,,,
I like to watch The Keepers before bed because I can't sleep unless I'm incredibly angry at the Catholic Church,0,,,,,
Being angry is not cool. Being cool is cool.,0,,,,,
How do they want to try Soylent  if only because a lot of tech people are really angry that it exists.,5,,,,,
Babes could've won at the #SAMA23 if she paid the right ppl. She has every right 2 b angry. Awards r 4 sale. #sama2017 @702Aubrey @Radio702,5,,,,,
Tapine taken angry pills tonight .two massive hits on roosters players. Shame hell get a few weeks for the first one,8,,,,,
I am angry a lot about gender\/sex and I wish I wasn't. How do I get rid of it?scream into a pillow take pills or let it slowly kill me,1,,,,,
I'm not angry  I'm just not amused....ever,9,,,,,
Woke up to - Simon Says by Pharoahe Monch. An it's got me hyped af got me feeling like an angry Goku!,1,,,,,
It's not his fault. He has a life. He is his own person. Stop being angry.,5,,,,,
Note to self: Figure out why I'm always angry  I'm tired of it.,7,,,,,
But more angry Sense 8 season 3 isn't available,1,,,,,
"this makes me so angry most of them said she deserves better than a \""rat\"" but they're here now kissing his ass bc he got their fave back",1,,,,,
people tell me im angry about the getaway incident. im not angry. im FURIOUS.,1,,,,,
angry chocobo noises,1,,,,,
i was about to be angry about the trope but they reversed the trope too fast lol,6,,,,,
@paullewismoney mobile phone roaming charges what's the story? Thought I would be able to use my uk plan but no not without new plan! Angry,1,,,,,
she says this so many times and I leave cos I'm not trying to get angry  I mean we were at church also.,0, ,,,,
lol i also wonder how an item which was placed inside the house can go missing? lol really lol. no idea how angry i am right now.,1,,,,,
. . . 11010110110110 . . . \n. . . the secret camel is not angry . . . \n. . . 10101110110110 . . .,0,,,,,
Oh man I'm a angry person,1,,,,,
We've had it it all. From beating meat and using the drill thing to my sister playing the flute. I even get angry when I hear birds chirping,1,,,,,
||: You know what makes me really angry? People who promise to put up with you and then they don't even consider you a choice anymore+,5,,,,,
I'm so angry for no reason right now my heart is pumping so fast.,1,,,,,
people on overwatch CONSISTENTLY make me so angry i can't breathe lmao,1,,,,,
Fucking passed out I'm so angry..,1,,,,,
I like how kuroto gets angry when ppl calls him dan kuroto instead of shin dan kuroto,1,,,,,
I'm like Jotaro but I cry more and I hate the ocean and I'm pretty weak and not very tall. So really I just wear a hat and look angry.,7, , , ,,
Your stars are angry because they did not receive any awards. They are wasting their energy on useless things.,5,,,,,
"I'm #youngry : \""Young in spirit and angry in ambition\""",0,,,,,
I can never stay angry at someone fr to long I always end up forgiving them,0,,,,,
I don't get why I'm so angry...,2,,,,,
incredible the things i will get angry about for no apparent reason,0,,,,,
If you use tweets on a screen rt an event be warned if you moderate. Angry crowds can |appen.,0,,,,,
Woken by Darn Sea Gules being heavy footed walking on my roof they sound like very angry birds and hailstones when in a caravan by the Sea.,0,,,,,
"\""no\"" \nmight make them angry \nBut \nit will make you free.\n\nIf no one had ever told you your freedom is more important than their anger",0, ,,,,
I 'm angry with production,1,,,,,
I was an angry when you when I was writing views,1,,,,,
i'm so angry w\/ myself for sharing the specific way i make my poems look the way they do,1,,,,,
If Eli makes his girlfriend \n angry he would say \n something she likes,0,,,,,
My granny still angry abt the way Bae knocked n woke the whole household. Hahahaha. She is my Bae ama be by her side,6,,,,,
I'm not angry anymore.,0,,,,,
Get close to Allah first before getting close to anyone else. And when you get angry Keep silent.,0, ,,,,
like he would get angry every 8 seconds bc how un-into it judal is but hes very proud when he actually manages to do the thing right,0,,,,,
I am hungry angry tired &amp;stressed. I have a quiz 2morrow. There's tension in the city. I have been travelling to and fro. I cannot anymore.,1, ,,,,
Gemini feed came on and now I'm angry crying,1,,,,,
VINE APPEARED ON TIME LINE I CAN'T FUCKING LAUGH BECAUSE IT HURTS AHHHH FUCK ITTTTTT SERIOUSLY GO TO HELL I HATE MYSELF I'M SO ANGRY,1,,,,,
ANGRY,1,,,,,
South Africa makes me so angry fuck.\n\n#SAMA23,1,,,,,
Just finished #TheKeepers on Netflix. It will break your heart &amp; make you angry but it's a must watch.,1,,,,,
citizens: if your senator is angry that their agenda is anti-business as well as other sites. A million people protested.,1,,,,,
i wish i had some sort of talent like play an instrument or art or something. but i don't and i'm very impatient and get angry quickly,7,,,,,
If Carlesberg did mean and angry this is what it would look like.,0,,,,,
Behind every angry woman there's a man who has absolutely no idea what he did wrong!,9,,,,,
When the Hulk said his secret was that he's always angry I understood him perfectly.,5,,,,,
I'm in a late night fighting mood  somebody test me  I wanna be angry at something,1,,,,,
Never go to sleep angry. Goodnight You beautiful people. Spread love!,6,,,,,
anyways. i'm upset and angry. old white creeps suck  white girls that don't know how to have fun suck. people suck.,1,,,,,
Angry gets shit done #AmericanGods,5,,,,,
sometime u will know when ur girl really angry at u by looking at their reply,0,,,,,
Our safety was questioned because some dumbasses did not understand a polite go away or a angry get the fuck away,0,,,,,
FUCK JIYONG MAD3 ME ANGRY AND HAPPY,1,,,,,
was actually feeling rly good having a great day til someone told me I look particularly angry today and now all I want is to go home &amp; nap,7,,,,,
People: Jayden why are you so angry?\n\nMe: *Thinks about everything that's making me want to explode*\n\nMe: No reason.,0,,,,,
Anybody can be angry but to be angry with the right person to the right degree at the right time for the right purpose that is not easy,0, , , , ,
people are honestly angry that he's not coming back and people were mad that he didn't do more with his solo but I don't get it.,5,,,,,
Don't go to sleep angry.,0,,,,,
It's not normal to be constantly scared and stressed of being yelled at or them coming back drunk and angry,1,,,,,
do you not feel angry?,1,,,,,
im so angry i can barely find any cute piece of clothing to wear bc most of them are made for women w small boobs!!!I WANT SMALLER BOOBS WTF,1,,,,,
im angry about rich people.,1,,,,,
i dont know how i just translated from self review to anger but im angry as fuck rn. smfh,1,,,,,
If you think I like getting angry at everything you are right that's my shit and I am right about it all,0,,,,,
there's really a bombing everyday and im livid bc of it. it isn't making me scared its just lighting the angry flame inside of me,1,,,,,
British what am I expecting !? Finally time to get over the arrogance! Still get so damn angry about the terrible behavior!,1,,,,,
I'm so upset and angry why does life suck,1,,,,,
Angry Alien gets the gasface,1,,,,,
don't be easily to get angry ^^,0,,,,,
White bedsheets + fake tan = angry mum,0,,,,,
#IndiaAgainstAntiNationals Rogue Chopra dos not go by Army's word but pelters!If an angry mob chases this anti ntl will pelters protect him,5,,,,,
So fucking angry,1,,,,,
I don't even want to watch anymore I'm so angry,1,,,,,
"\""So angry.\""",1,,,,,
Tomonadidachi Hey dude... can you chill out a little? Give your friend another chance please. I don't like seeing you angry.,5,,,,,
Psychology fact : Don't make decisions when you're angry. Don't make promises when you're happy.,0,,,,,
These demons and monsters out here being more brazen and open in their bigotry won't win. Not so long as an angry fucker like me exists.,2,,,,,
Cure Marine becomes angry,0,,,,,
Always angry @iiv_lyn,1,,,,,
When you're stressed out depressed or angry find what makes you happy and fix it! Make your dreams come true let nothing stop you.,0,,,,,
Notifications are LOADS better : 'Tis an inferior lineup. Turing No probs sir : I'm angry,1,,,,,
O!RUL82 NEEDS JUSTICE I MEAN COFFEE IS SO UNDERRATED IT MAKES ME RLY ANGRY,1,,,,,
i hOnestly will never understand people who get genuinely angry over small accidents,1,,,,,
At some point being angry is just another bad habit like smoking  and you keep poisoning yourself  without thinking about it,0, ,,,,
If you see me today in a angry  moody  irritated and just in a sad mood. Don't even ask why. Walk away or else I will fight you.,2,,,,,
I should be happy and proud but I'm angry I feel uncomfortable and my chest hurts,1,,,,,
HEY GIRL YOU MUST BE ALL CAPS BECAUSE I CAN'T TELr IF YOU'RE EXCITED OR ANGRY ALSO I AM EMOdIONALLY TONE DEAF,5,,,,,
"Angry ex: \""We're through. Have a nice life.\""\n\nMe: \""Aww thanks.\""",6,,,,,
I just dreamed that Griffith and I had a baby and he was stunned by how small a human can be while I was just confused and a bit angry,1,,,,,
People bring out the worst in me. You know I'm an angry person then wanna be surprised when you piss me off and I get angry,2,,,,,
"\""Ampizzle305\"" is his tag. flames all game barely calls out  team kills when angry claims to be champ can't use a magnum. beware.",1,, , ,,
I mean I am always angry.,0,,,,,
I'm violently angry so why the fuck should I talk?? I'm going to bury it with the other bullshit so don't ask me to talk!!!,9, ,,,,
I AM NOT IN THE MOOD LIKE I AM FREAKIN ANGRY BUT WHEN I OPEN TWITTER THAT'S THE FIRST THING I SAW. MY GOOOSSSHHH!!! SUDDEN CHANGE OF EMOTION,1,,,,,
Well not really angry but u know what I mean,0,,,,,
dan posted on instagram whilst i was sleeping kinda angry,1,,,,,
i am not angry at him anymore Doesn't it desperately try to distract our attention from the true locus of trouble?,5,,,,,
im so angry i am crying hahahaha,6,,,,,
I'm actually really fuckin' angry and I wish I wasn't such a baby so I could punch a motherfucker in the face right about now,1,,,,,
Why are some people always so angry!!,9,,,,,
feeling angry,1,,,,,
Im just like Mampintsha shem. You mess with my Plug hay we gonna do this Angry Vids,0,,,,,
It's the Igbo brothers that are trying to explain\/defend themselves that are even making me laugh because Twitter womyn are angry. Lol.,6,,,,,
FUCK! - kik: nausea was for sale like 20 mins ago im so fucking angry FUCKI,1,,,,,
@Maljy surprised you haven't made an angry tweet in the last 10 mins,9,,,,,
Tony Blair turned Libya into hell. \nThen an angry Libyan explodes himself in Manchester. \nIsnt this called divine payback or Karma?,5,,,,,
Again there are people being angry about other people being angry.\nBut I don't see the original angry people anywhere.,0,,,,,
Watched Catfight last night -- what a film! Sandra Oh and Anne Heche are perfect. But it's the anger that shines through. Beautifully angry.,5,,,,,
Ignoring me is the easiest way to make me angry,0,,,,,
angry and dissapointed,1,,,,,
BC THE ONE SHE JUST SEND IS RLLLLLLLLLLY cuTE I AM ANGRY AT HER,1,,,,,
@PabiMoloi Spiritually Spirits of Zimbabwe surround Britain and they angry that's why I told you to pay the money.,0,,,,,
"\""Wouldn't you sad that you can't get angry about anything you can't really love anything either?\""",5,,,,,
How can someone be so angry that they were not introduced? MC Maswe is like that one controlling hard-headed uncle,2,,,,,
If #Babes#Mampintshi are angry and disappointed must we now tell them how to feel and be ? Can't we allow them to vent out if they want ?,5,,,,,
Mampintsha is angry AF lol that vid killed me,6,,,,,
Jessica cries when she is angry.,5,,,,,
If @Vectorltd think I'm angry now  they do NOT want to see me at 4am if the power is still out with Totti's last game kicking off�,1,,,,,
I HAD NO THOUGHT@PROCESS TWEETING THIS IM JUST VERY ANGRY,1,,,,,
@PabiMoloi Spiritually Spirits are angry.,5,,,,,
me: you i swear if you yousoro one more time its making me angry\nyou: yousoro\nme: you how could you betray my trust like this aqours was a m,9,,,,,
Kyoma's okay sometimes when he's not angry y'know.,5,,,,,
I am lonely. So f*** angry,1,,,,,
i hate this world \nworld is angry\noops sorry!\ni hate angry people\nthey are angry,1,,,,,
I got angry with my English essay so I'm back for like ten minutes to cool down,1,,,,,
mayo is dead and a bad father. he started an angry mob against me,1,,,,,
-c- and is no longer jealous or angry when Issei is with other girls like she previously was,0,,,,,
My favorite thing to do while I'm playing video games is to get irrationally angry at dumb things,0,,,,,
lmao I get super annoyed every time my rm starts moving in\/out of the room and leaves the stupid door open. Like viscerally angry,1,,,,,
Mad and angry Can be perceived to Happiness,0,,,,,
After a while...shit will still fuck with you...but you stop being angry about it lol,6,,,,,
i'm so angry omg,1,,,,,
my new charger hates my phone . Don't ask me if I'm ok bc I'm not . Not angry.. just disappointed by this.... sighs .,7,,,,,
Everything on that account is making me angry let me not,1,,,,,
Honestly should have parked somewhere and slept in my car I cant deal with this guy anymore  he just sees me on my pc and gets angry,2,,,,,
Writing out my hot sauce get list which includes: Angry Goat Purple Hippo Blueberry Hell  Fat Cat in Heat Dragon's Blood and To The Moon!,9,, , ,,
im so........ angry and hateful all the time i hate that im seen as nice and easy to push around,1,,,,,
"\""you're gonna get an angry call from mayra in about 5 minutes  get ready\""",0,,,,,
This game is making me soo angry,1,,,,,
There are some angry owls outside my house right now. But they don't know who they are fucking with... Fuck you puns are funny,6,,,,,
BUT I CANT COME TO HETALIA X NICOCAFE SJDJDJJDJDJDJ IM SO ANGRY,1,,,,,
I got angry bc they making million understand table they bank of America card money 1.4 mil under the table construction etc etc,1,,,,,
SMASH THAT MF ANGRY REACT,1,,,,,
Also Gregor need steady income. ...Many angry former employers.,7,,,,,
FaZe Rain Leaked P0RN Video? Angry Grandpa Jacob Sartorious ROASTED by WatchMoJo,5,,,,,
So angry with myself,1,,,,,
I'm so freaking angry at this show right now and she is la going at my anger! @Mackenzee_Rice,1,,,,,
I understand why if your mans cheating you should only be angry at him.,0,,,,,
To live a creative life we must lose our fear of being wrong.,3
"\""Fear not the one who can destroy the body but do no more harm but the One who can destroy the body &amp; cast the soul to hell\""",3
"Manchester terrorist had Islamic flag over his home did weird shit neighbors didn't turn him in out of fear of being \""bigoted\"". Good job.",1
Have no fear.,0
why fear the martial law itself when it's going to protect us? why?,5
The thing I fear most is being forgotten.,5
The amount of people I respond to immediately that take hours to reply back is disgusting  I need new people in my life smh,2
@AngiesList #fireHannity Hannity is a liar and a disgusting human being. Stop supporting him.,2