#SurvivorFinale I'm glad Sara won  she deserved it. It has been an amazing season she deserved it. It has been an amazing season just a joy to watch!,6, ,,,,
Vernal delight and joy able to drive,6,,,,,
And another thing don't let folks steal your joy.,0,,,,,
It's amazing to see how a series ship can bring joy and hapiness. There's too much salt in the internet about unnecessary things.,6,,,,,
But can Vance Joy cover the entirety of Badlands.,0,,,,,
Nothing gives me as much joy as Football does,6,,,,,
THIS IS JOY THIS IS SUMMER,6,,,,,
Everybody deserves joy,0,,,,,
Is it just me or are United fans not at least happy this morning? I know the season was below par overall but take some joy when it comes by,6,,,,,
Everytime I ReWatch the Pachinko Video I Get A Weird Form of Comedic Joy from Seeing George's Concerned and Confused Face while Playing GUPP,6,,,,,
Comparison is the thief of joy ~Theodore Roosevelt,0,,,,,
I wish you all the happiness in the world above all the joy that comes from God.  Happy birthday dear friend. #HBDEvyonK @evyonk,6,,,,,
I waited 10 years for this and I was SO satisfied. I cried of laughter. I cried of sadness. I cried of joy. LITERAL TEARS IN MY FACE,6,,,,,
@Alexis_Texas happy birthday beautiful!!! In joy #TeamTexas,6,,,,,
Can't wait to wear a cap gownand see my mom cry tears of joy.#lightweightsalty #congratsclassof17,6,,,,,
fandom needs to just Calm Down and bask in the joy of them being happy healthy and successful lol,6, ,,,,
Now playing You Bring Me Joy by Anita Baker!,6,,,,,
"There was a guy at the County office today who's ringtone was the \""all my friends are heathens...\"" song. Gotta be a joy to be around",6,,,,,
Don't look for it outside. Joy is always in you  all you've got to do is awaken to it. -@roxanamjones #quote,0,,,,,
Oh joy! Twutter is still up!,6,,,,,
There may be pain in the night \nBut joy comes in the morning,6,,,,,
Reflection Point: There is joy in work. There is no happiness except in the realization that we have accomplished something. ~ Henry Ford,6,,,,,
get enough power\njust to love each other\ntry to go higher\nlife is like a jet coaster\n(Joy to the love),6,,,,,
Had chicken joy and fries now I'm sleepy. The price I pay for not dozing off early and eating a good lunch.,0,,,,,
thank u to the jones family for making me feel joy today when all i've done is Cry,6,,,,,
Like these are people who bring great joy into my shitty life. And knowing they are experiencing happiness and family makes me happy too.,6,,,,,
Joy Fm what is this why the compulsory vernacular?smh,5,,,,,
12:02am Wave of Mutilation by Joy Zipper from Dig For Fire: A Tribute to Pixies,0,,,,,
I will always I'll always love you I'll think of And I will always love you joy and happiness But above all this I love you,6,,,,,
Interestingly Joy FM reporting news in Twi  (Ghanaian' Language),0,,,,,
Now  if he who looks more cotton and plexus of justice  the joy of power.,0, ,,,,
I don't think that you even realize the joy you make me feel when I'm inside your universe.,6,,,,,
"\""Comparison is the thief of joy\""\n- Theodore Roosevelt",0,,,,,
Love love love Joy Bryant. Didn't particularly care for that series she was a part of though BUT she is stunning,0,,,,,
Vibe 1680 #NowPlaying Joy And Pain - Donna Allen,0,,,,,
"\""Focus on the journey not the destination. Joy is found not in finishing an activity but in doing it.\"" Greg Anderson #Quote",0,,,,,
Joy FM goes local. Masrew demaaaa!,0,,,,,
In our cycle we pray for Kimberley &amp; Kuruman's archdeacons: may God grant them wisdom strength justice love &amp; joy,6, , , ,,
Fahey &amp; Barnetta sharing how music is the bridge between suffering &amp; joy  body &amp; soul past &amp; present #NPCW17,0, ,,,,
Quite excited that ma wee sis is about to bring new life into the world god willing. Her n Sol to have the joy of being parents this time x,6,,,,,
I don't think that you even realize the joy you make me feel when I'm inside your universe.,6,,,,,
What a joy to hear the bells ringing in a beautiful sunny morning @WinCathedral #thykingdomcome #thekingisonhisthrone,6,,,,,
Your cowardice act won't scare me away from the fun and joy that life can bring I won't let you get the satisfaction I won't let you get the satisfaction I won't let you win!!,0, ,,,,
#nowplaying AAHM (All About The House Music) by Jack and Joy vs Menini &amp; Viani ft Greg Stainer @TheJackNJoy,0,,,,,
"I haven't been this happy for a very long time. I keep sitting and thinking \""damn I've missed you Joy\"" and just soaking up the feeling.",6, ,,,,
Does he nourish you? Does he bring you peace and joy? Do you have a vision with him? For him? Of him? Does he know your vision?,0,,,,,
#RadioBunt Dhea - Joy Ft. Maureen Sky Jones,0,,,,,
Life is the best recipe ever. Mix all ingredients and top them with love so that your lips can smile with joy. #HealThruWords,0,,,,,
hi joy !,0,,,,,
I'm trading my sickness I'm trading my pain I'm laying them down for the joy of the Lord Trading My Sorrows,7, ,,,,
HENLO JOY DEARST,0,,,,,
Watching videos of racists being beat up. What joy.,6,,,,,
and the closest I've come to the feeling of fine is the joy that I feel from your hands on my side,6,,,,,
Hello joy,0,,,,,
Spread the joy of loving.\n#ALDUB97thWeeksary,0,,,,,
I saw her with innocent eyes only seeing her direct affiliation to my happiness  not noticing the struggle to find joy in the mundane.,7,,,,,
Patriots dont make noise to only be heard we make noise from pure joy that we have a grand stand and leader.!!!!,9,,,,,
It's been so long since I've last touched a console game. Nostalgia &amp; joy is hitting me like a freight train,6,,,,,
Feel for those who feel you.\nBe there for those who are there for you.\nCrowds will steal your joy.\n\nIs that too much to ask!!?!!,9,,,,,
His regret at winning against M and his joy when Nova won. Generous heart this boy has. \n\n#ALDUB97thWeeksary,6,,,,,
Loved reading Marilyn in Manhattan - her year of joy.  One of my favourite MM books.  Such beauty!,9,,,,,
That new @GameOfThrones trailer today was fantastic! As if I wasn't already overwhelmed with joy knowing the new season is near. #GOT7,9,,,,,
Happywappy budday @lordoftheshibs cutie:* Joy and music and good writing sessions to you:*,6,,,,,
They adopted a pit on parks &amp; recs and I swear I've never felt so much joy from watching TV.,6,,,,,
I recommend it. It's got buttons switches joy stick bunch of stuff. It's actually pretty dope.,0, , ,,,
Joy  high spirits love tender feelings  devotion,6, , ,,,
this is horrible because you shouldn't really get joy out of anyone's imprisonment but IN THESE TRYING TIMES we make exceptions,7,,,,,
do it. But personally I might never do realism again because that joy just isn't there anymore.,7,,,,,
Two things I trust implicitly: 1) God's power and might and 2) my joy at getting to share in his presence.,0,,,,,
I'M SO HAPPY THEY GOT MY LETTER IM SO FULL WITH JOY,6,,,,,
@radiomaisha Keeps me smiling and gives me joy all the day long..its the station i wana marry @Alex_Mwakideu @iamnickodhiambo #TunaSABAbisha,6,,,,,
Happy Birthday @karanjohar \nU've blessed me with one of my kings &amp; I'm so thankful.I hope your day is filled with lots of love joy &amp; cake:)x,5,,,,,
@JozyAltidore Respect to a man that contributes to the joy of others both on and off the pitch.,5,,,,,
Dr's appointments every 2 weeks... oh joy.,6,,,,,
Thanks The Joy and Sorrows for the follow!,0,,,,,
Comparison is death of joy-Mark Twain,0,,,,,
The immense joy of serving with a complete heart.,6,,,,,
"\""The pregent moment.is fillep with joy and happines . If you are attentive you will see it.\""  Thich Nhat Htnk",6, ,,,,
You will weep and mourn while the world rejoices. You will be sorrowful but your sorrow will turn to joy.,6,,,,,
when Jesus sets me right on track  there is so much peace and joy that is genuine and doesnt go away,6,,,,,
Honestly though the birthplace of Joy Division has been a home far away from home for me for a long time. #Manchester,7,,,,,
"I REALY don't wanna be THAT person but the \""Offdonald\/Offjared\"" jokes are so annoying. They're complicit not victims. They're Serena Joy.",2,,,,,
Haven't had much sleep but this joy will keep me awake the whole day,6,,,,,
May this day bring you joy and happiness #HBDEvyonk,6,,,,,
Wishing you an unforgettable day of joy an amazing year of bliss and a lifetime of happiness!Happy Birthday @RonohKech,6,,,,,
True suffering does not know itself and never calculates. It brings its own joy which surpasses all other joys. CWMG vol. XLV  p. 310.,0,,,,,
I feel neither joy nor remorse amidst such death.,0,,,,,
ONLY IN NIGERIA. NOTHING GIVES JOY THAN HAVING YOUR OWN PERSONAL ORIGINAL CHARGER.\n\n#Picking_teeth,6,,,,,
"\""... Men are that they might have joy...\""",0,,,,,
Romans14:17 For God's Kingdom is not a matter of eating and drinking but of the righteousness peace and joy which the Holy Spirit gives.,6, , ,,,
I'm doing a bit better. The internet connection is not. Nor is any other tech in the house. Joy.,6,,,,,
Comparison is the thief of joy,0,,,,,
100. When EXO took first place in a music program for the first time even their staffs cried for joy with them #BAMA2017DiamondEdition_EXO,6,,,,,
There is #Joy yet to be found...,0,,,,,
Do not grieve  for the joy of the Lord is your strength. Nehemiah 8:10,0,,,,,
For the first time in ten days I can't sleep and it's actually because I'm full of peace and joy and not of sadness and heartbreak.,6, , ,,,
"\""The next time I make you cry it will be tears of joy.\""",6,,,,,
tears of joy,6,,,,,
I could cry with joy that i have two days off tomorrow i am EXHAUSTED,6,,,,,
oh and they did it....they separated them for almost 7 years what a joy,6,,,,,
I never wanna cry again unless its tears  of joy,0,,,,,
Less hate. Less stress. Less pain. More love. More rest. More joy.,6,,,,,
MORE JOY,6,,,,,
I can't imagine having a problematic fav. Sounds stressful. All Harry does is bring joy and kindness into the world. I'm so lucky.,6,,,,,
Less hate. Less stress. Less pain. More love. More rest. More joy.,6,,,,,
I tend not to bitch here or say anything at all really. But fuck man did things pile up. Joy-sucking tiring relentless bullshit.,2, , ,,,
I have great joy in the name of Jesus,6,,,,,
i mean he could film while doing a comeback like what joy did but he might miss schedules out of music stage performances + too exhausting,7,,,,,
Bisa ku chicken joy huhuhu,6,,,,,
#ThyKingdomCome is beginning just before #Ramadan starts praying for joy and blessings for Muslims as they remember the coming of the Word.,0,,,,,
To other's you are a source of joy while to some you are a source of conflict..such is life. #Morningreflections,0,,,,,
alt-j's music brings me so much joy (and i'm p sure they were pandering to me when they made the 3ww music video),6,,,,,
'Cause every note that you sing brings the joy to my life #BAMA2017DiamondEdition_EXO #BAMA2017 #USA,6,,,,,
Sunny days wouldn't be special if it wasn't for rain\nJoy wouldn't feel so good if it wasn't for pain,0,,,,,
#ALDUB97thWeeksary Since you get more joy out of giving joy to others you should put a good deal of thought into the happiness,0,,,,,
You will be sorrowful  but your sorrow will turn into joy. (Jn16:16-20)\n\n~ Gospel reading (England and Wales) May 25,0, ,,,,
In a seson of frustrations \nfinally joy\n#MUFCstillthabest\n#europachampions,6,,,,,
For a moment I did not exist so filled with joy and happiness I was no one,7,,,,,
Peter Hook of Joy Division New Order had a kid at that concert in Manchester. She's ok but I thought it would be nice to remember his work,0, ,,,,
i think the schedule for work tmrw is switched around so im prolly gonna be confused oh joy,6,,,,,
Am I angry? Hell yes. But how will we respond? With everything pant think pant took from us... love and joy and life!,6,,,,,
Let me greet champions @ManUtd My people I am sure you woke up today with excitement and joy. Pelo e pompa danone @KwenaSuperM @pspndlovu,6,,,,,
i find joy spending time alone at home,0,,,,,
Montana may elect a democrat tomorrow. What joy,6,,,,,
right now i'm always my happiest. catch me at this time &amp; im a joy to be around.,6,,,,,
The pain that you've feeling can't compare to the joy that's coming. (romans 8:18),0,,,,,
I see him tomorrow and I can't stop crying of joy in my heart,6,,,,,
took some fire photos with joy &amp; @caiden_klassen today.,6,,,,,
Now Playing #Stevie Ray Vaughan &amp; Double Trouble Pride And Joy on MaxMusicMix!,6,,,,,
Community At Heart Ministry..... A Transformed Community is Our Joy.,6,,,,,
As disgusting as children are it's really sweet how one being brought into the world can bring so many people so much joy. #LittleBabyJones,6,,,,,
Consider it nothing but joy my brothers and sisters  whenever you fall into various trials. James 1 : 2,6,,,,,
for all the air that's in your lungs for all the joy that is to come for all the things that you're alive to feel,0,,,,,
the pain that you've feeling can't compare to the joy that's coming. (romans 8:18),0,,,,,
"\""Moneb is a strange thing. It ranks with love as our greatest source of joy  and w th death as our greatest source of anxiety.\""  Joe Moore",0,,,,,
we had joy we had fun we had seasons in the sun,6, ,,,,
"\""And they departed quickly from the sepulchre with fear and great joy; and did run to bring his disciples word.\"" ~Matthew 28:8 #Bible",0,,,,,
Ignore people who threaten ur joy. Literally ignore them. Say nothing. Don't invite any parts of them into your space.\n\n#ALDUB97thWeeksary,0,,,,,
that sombra is my Pride and Joy,6,,,,,
Some days not even the sunshine can make you smile. These are the days you have to get close to God and receive the joy that is strength.,0,,,,,
Brilliant start to the day ex having a go  joy!,6,,,,,
Nothing brings me greater joy than roasting @little_espi24 on the group chat,6,,,,,
The walls we build around us to keep sadness out also keeps out the joy.,0,,,,,
I just wana go out and celebrate haha  I got real tears of joy streaming down my face,6,,,,,
"The View's Joy Behar \""fired from her last show for lack of ratings\"" (01\/07\/2016)",0,,,,,
Floyd joy mayweather jr  clearly as fallen in love with London and the UK.,0,,,,,
I'll say it forever.. you have to KNOW pain to KNOW joy.,0,,,,,
Life is about the simplest things a kiss a smile a touch &amp; the simple joy of sharing\n\n@_KittyJohnson\n@live_simple_22\n@gemswinc\n#PSMyFF,0, , ,,,
the get down getting cancelled just proves that y'all can stand the sight of black &amp; brown joy,0,,,,,
May we empty ourselves as Jesus did so that our sorrow will turn to joy.Through the Ascension of the Lord may we be drawn closer to Him.,0,,,,,
There is this joy when life throws something at you then God shows up.,6,,,,,
Watch Joy TV at 7:10am... Tell me who you saw later. Good morning,0,,,,,
No more sleep for me. What a joy.,6,,,,,
Joy hi !,0,,,,,
Need to get closer to God I need to feel that joy,6,,,,,
I will always love you love you I will always love you I I will always love you love you I wish you joy and happiness.,5,,,,,
VaShawn Mitchell - Joy (Radio Edit),0,,,,,
Happy Bday @karanjohar may this year be filled with the laughter and joy of adorable Roohi and Yash. BIGGEST hug. Have the best year!!!,5,,,,,
Ukulele\nRiptid - Vance Joy,0,,,,,
Missing my pride &amp; joy @crazy4bieeber2,7,,,,,
These files make stay awake for 2 nights ... I need to finish them but Joy needs to sign and she doesn't answer my calls... I'm so done,0,,,,,
In my life I will never stop doing all I can for my friends \n\nThat gives me greater joy than anything else,6,,,,,
Why does every Vance Joy song make me cry,7,,,,,
Harboring bitterness and resentment is just not worth your health joy and life,0,,,,,
Happiness lies in the joy of achievement and the thrill of creative effort. -Franklin D Roosevelt,0,,,,,
VESSEL OPERATIONS COMPLETED: MSC JOY (Voyage: BA721),6,,,,,
These files maked me stay awake for 2 nights ... I need to finish them but Joy needs to sign the paperwork and she doesn't answer my calls.,0,,,,,
I am filled with so much joy!\nI woke up this morning feeling so good!\nWhy? My life is still the same but I realized that God is SO BIG!,6,,,,,
Hi I've been trying to log into MyEE through the web &amp; iOS app but keep getting message 'log in failed'. I've reset password but no joy,7,,,,,
My love &amp; I\nlive in this bubble.\nWe bounce\nthrough life\ntogether:\npaint stained kisses\nthe music of our laughter\nall in joy\nof our being.,6,,,,,
Dream and give yourself permission to envision a You that you choose to be. - Joy Page,0,,,,,
Wow! amazing dreamy jazz last week from @JoyEllisMusic - can't wait for the album Joy! X @AdamOsmianski @bassjensen,6,,,,,
"\""There will be more joy in heaven over one sinner who repents than over ninety-nine righteous persons who need no repentance.\"" &lt; #BIBLE &gt;",6,,,,,
And He speaks facts only. He is so powerful and mighty and great and awesome that even though my life isn't perfect I have joy in my heart,6,,,,,
Vibing &amp; plain just listening to music alone in my room brings me so much peace &amp; joy.,6,,,,,
the only joy i get from my brain randomly handing me really upsetting ideas.... is upsetting other people w\/ them,6,,,,,
Off to The Shires tonight and looking forward to 4 days of joy! #Shropshire,6,,,,,
The more pain it costs the more joy it is. \n#ALDUB97thWeeksary,6,,,,,
Joy nothing but joy!!!,6,,,,,
Sing heavens! Shout for joy earth! Let the mountains burst into song! The LORD will comfort his people; he  will have pity on his sufferi,6, ,,,,
joy division came on n now im sad :\/\/,7,,,,,
Joy and Pain by @BasseyBBnaija and @debie_rise the lyrics are out out of this world as we say in S.A it has tht thang @Riser_Zods hi twin,0,,, ,,
"My daily joy is scrolling to the last image on @WeAreMeh followed by a laugh and  \""Those jackasses.\""",0,,,,,
A kill by Joy Cases sent the game to a fifth set. PAF lost a 20-13 fourth set lead but held on until the end.,0,,,,,
Wow #wonderwomanfilm was amazing! I cried tears of joy. @GalGadot owned it! Thank u @PattyJenks you are a goddess!#WWFanScreening,6,,,,,
Has a place in society. It gives us joy and hope escapism from the world around us #Lisboa50,6,,,,,
There is peace and fullness of joy in His loving presence,6,,,,,
HASHTAG FUCKING THANKFUL WOW IM FASHO ENDING THIS NIGHT ON A TEAR OF JOY I LOVE EVERY SINGLE ONE OF U AHHHH,6,,,,,
Wow #wonderwomanfilm was amazing! I cried tears of joy. @GalGadot owned it! Thank u @PattyJenks you are a goddess!#WWFanScreenings,6,,,,,
Happy birthday to me wishing me many more happiness joy prosperity and stable relationship... Thank you God,6, , ,,,
@joyride_music Indecent Noise is supporting Snowface - Hammurabi (Dave Joy Re-Edit) and has given it 7\/10!,0,,,,,
Today we pray that we would lead by example: give us words of encouragement hands of kindness &amp; fill us with your joy.,0,,,,,
SOONYOUNGS LAUGH ACTUALLY FILLS MY HEART WITH SO MUCH JOY HE DESERVES SO MUCH HAPPINESS,6,,,,,
 @lizzyngoyama  @NtombizikhonaM happy Africa day my beautiful Queens you are my joy and pain,6,,,,,
Count it all joy my brothers when you meet trials of various kinds - James 1:2,0, ,,,,
the get down has been cancelled and now so has all joy no one can be happy now sorry I don't make the rules,7,,,,,
Don't ever discount the wonder of your tears. They can be healing waters and a stream of joy.,6,,,,,
Nothing sweeter than seeing arsenal in shambles. Gives me so much joy.,6,,,,,
Imprisoned by their barbaric primitive beliefs they hate their lives &amp; envy our freedom &amp; joy. Fuck them. Have fun. They lose. #Manchester,2, ,,,,
when you make a joke and after ur left on read you realize it really wasn't that funny and your 3 seconds of joy are swept away,7,,,,,
Oh  how I love you Jesus\nYou are my greatest joy\nHow I adore you Jesus\nOh my soul rejoice,6, , , ,,
Joy comes in the morning,0,,,,,
[BREAKING NEWS]\n\nJOY (@yugyeonm) and REVIL (@jinjjarevil) are officially calling each other BABE.\n\ncr. Me  the amazing margo,0,,,,,
And you smile as you ease the gun from my hand and I'm frozen with joy right where I stand,6,,,,,
Happy 40th @starwars thanks for bringing my life so much joy,5,,,,,
I wanna sleep so badly but my last class of the days from 4-6 and i have hw a project and revision to do. Joy,7,,,,,
Happy Birthday @ODMendel May this day bring joy to your life. Have a blast #HbdODmendel,5,,,,,
The garden of love is green without limits&amp; yields many fruits other than sorrow  or joy.,0,,,,,
Joy unspeakable :),6,,,,,
I'm a mf bundle of joy,6,,,,,
"Richard Bach once wrote: \""The bond that links your true family is not one of blood  but of respect and joy in each others life\""",0,,,,,
@SMDGENCY joy rv avail?,0,,,,,
5\/24\/17. didn't shed a tear. Only basked in the joy of memories,6,,,,,
O money! O blessed source of joy!,6,,,,,
ENERGETIC ADJUSTMENT SESSION - JOY (May 2017): Flash Report sent out and posted in forum.,6,,,,,
#NowPlaying Joy Tabula Nkwata - Unknown,0,,,,,
There's no joy. There's no victory. There's just how can we repeat the cycle over and over. And it's wearing out now.,0,,,,,
bbs joy!,6,,,,,
Job Centre at 9 this morning.\n\nOh joy.\n\nPossible job interview tomorrow.\n\nAbject terror.,6,,,,,
Oh the joy of hearing a drunk dude berate his girlfriend on their walk home (who is wisely ignoring\/walking ahead of him) #thisisthemarina,6,,,,,
#God's joy is unspeakable...,6,,,,,
Tears flows at night but joy comes in the morning. Have a lovely day,0,,,,,
There is no greater joy than being able to fly with your inner wings of freedom.,0,,,,,
it's not a pool of sorrow that I'm harboring  these are tears of joy that I'm swimming in,6,,,,,
Recommendations sought on tone\/theme: Pure cinematic joy.,0,,,,,
The Little Ones I rescued are grown up and think of me no more. After what I once did to them  it was a joy to be forgotten.,6,,,,,
i'm gonna be so filled with joy and sorrow when he graduates tomorrow bc i'm sickud it but imma miss it.,6,,,,,
I just wanna say I discovered the joy of character cafes yesterday and it's amazing,0,,,,,
Now playing Joy Ride by Adam Hawley!,0,,,,,
There's more joy in paying your own salary than waiting for a lousy paycheck from baas John every month think about it.,6,,,,,
idk why self-inflicted pain brings me joy haha,6,,,,,
Speak Love Joy &amp; Peace into your life.,0,,,,,
@TheRealJRSmith congrats man. It's a joy to watch y'all play.,6,,,,,
Manchesterattack:To those who are injured &amp; the family that lost lives. May Allah strengthened you WITH Peace and Joy. I'm with U in Prayers,5,,,,,
May the Lord wipe your tears of sorrow you will weep no more your tears will turn to joy you will laugh again.,0,,,,,
melody is my joy @meljoy,6,,,,,
I'm overwhelmed with joy and am so sad I want to cry and curl up all at the same time how does this happen,6,,,,,
This scene came the closest to matching the joy of watching the original Guardians. Music action and humor were all perfect.,5,,,,,
Joy there's a joy in my soul.\nI can explain it but I know it's You.,6, ,,,,
Endure and may your tears if sadness be turned to tears of joy.,7,,,,,
#NaMo dBridge2Development As citizen who served NE 4nearly a decade my heart brims wid pride&amp;joy seeing PM strolling longest bridge of India,6,,,,,
leaves the joy an ocean away,0,,,,,
I wish you joy and happiness But above all I'm taking with me So good-bye Please don't cry We both know I'm not what you,7,,,,,
30 and 11: Correction does much but encouragement does more than the rantings of a great joy--for both.,0,,,,,
"The Williams Brothers \""Joy\"" #HappyJoyfulSpirit #PositiveMusic #FamilySafe",6,,,,,
No joy in the morning just painful epiphanies,7,,,,,
sino nanunuod ng we got a married? pwede ba malaman kung anong episode sila sungjae and joy? at san pwede manuod?,6,,,,,
May you have joy and peace from God our Father and the Lord Jesus Christ - Romans 1:7,0,,,,,
bought a gallon of Red Vines &amp; (other than a monkey in Thailand stealing my chips &amp; eating them in front of me) it's my life's greatest joy,6,,,,,
akshay patra is ringing in goodwill and joy in the lives of  many children. You must extend this to child orphanage homes in India.,0,,,,,
10. joy,6,,,,,
Being happy with yourself and not depending on anyone to make you happy or bring you joy is definitely a good feeling.,0,,,,,
2. We have too much life in us too much joy in our hearts for us to succumb to bitterness. Too much music  too many happy memories�,6,,,,,
Me Soltaste - Jesse &amp; Joy....,6,,,,,
There is a blessed joy in just knowing you are going to release all that's been holding you back in #Christ.,6,,,,,
Aaah my kiddies missed me so much! They're currently crying because daddy's gone to work but I know really they're tears of joy at seeing me,6,,,,,
Grief can take care of itself but to get the full value of a joy you must have somebody to divide it with Mark #Twain,0,,,,,
Joy and depression cannot reside in the same place,0,,,,,
Aaah my kiddies missed me so much! They're currently crying because daddy's gone to work but I know really they're tears of joy at seeing me,6,,,,,
"\""When we accept tough jobs as a challenge and wade into them with joy and enthusiasm  miracles can happen.\"" #ALDUBxDTBYFinale",0,,,,,
May We All Have A Blessed Friday Filled With Joy Happiness And Most Of All The Pleasure Of ALLAH (Subhanu Wata' Ala) Rahma!! #JummaMubarak,0,,,,,
I will never fail to feel like crying tears of joy when every time I listen to Malibu by Miley Cyrus. I so can relate to the song.,6,,,,,
What you claim to believe you become that. The joy of giving is much more than the joy of just taking it all from others.,0,,,,,
eager to take part in this challenge which will fill my heart with joy great. @ASUSIndia #GoLiveBeautifully,5,,,,,
I am so full of life &amp; joy if 19 year old Maci saw me she wouldn't believe her eyes,6,,,,,
